026809902,(OCoLC)43636779,http://purl.flvc.org/fcla/dt/12602,"This dissertation investigates the nature of the relationship that exists between job satisfaction among temporary workers and general customer perceptions of service quality, customer-based appraisal of specific service provider performance, and customers' future behavioral intentions concerning doing business with the firm in the future (e.g., to increase business, to recommend the organization to others, etc.). The Job Descriptive Index (JDI) and its related Job-in-General scale were used to measure employee satisfaction. SERVQUAL was used to gauge general customer perceptions of service quality. A 13-item battery derived from marketing literature was used to measure customer future behavioral intentions. The customer appraisal of service provider performance was based on performance appraisal literature. Results indicated significant correlation between worker satisfaction and customer perceptions of service quality (r = .27; p < .01), customer-based appraisal of specific service provider performance (r = .30; p < .01), and customer intentions concerning doing business with the organization in the future (r = .20; p < .05). Customer quality perceptions were significantly associated with their future intentions (r = .71; p < .01) and with specific customer performance appraisal (r = .63; p < .01). However, when combined with general customer service perceptions (SERVQUAL), specific customer appraisal of service provider performance did not contribute unique predictive or explanatory capability. Unexpectedly, temporary workers' satisfaction with co-workers on their job assignment was significantly related to all customer outcome measures. The results are described and discussed in comparison with meta-analyses about job satisfaction, and in terms of other studies concerning contingent workers."
026190716,(OCoLC)12708627,http://purl.flvc.org/fcla/dt/13431,"It is the hypothesis of the writer that the average middle-income person would be better advised to purchase a whole life policy rather than to buy a ""lower-cost"" term policy with the thought of using the difference in ""cost"" to invest in common stock, possibly in an effort to combat inflation. An analysis is made of the returns one might expect from each method of investment, based on data in the past decade. On the basis of this analysis, it would seem that a person would have fared about equally well in a choice between the two methods, provided that such person did at least as well in the selection of stock investments as the averages of stock market results (in terms of over-all income, including both capital gains and dividends). Although no conclusive choice would appear to be warranted, the uncertainties inherent in the purchase of term insurance and investment in stocks would appear to preclude such alternative for any person not wishing to speculate."
026090175,(OCoLC)11365827,http://purl.flvc.org/fcla/dt/13502,"This study explored the effectiveness of the Manpower Development and Training Program in Broward County, Florida. A telephone survey was conducted with graduates from MDTA classes of 1970, and interviews were held with counselors, teachers, labor supervisors and analysts. The study disclosed that forty percent of the graduates had never worked in the occupations for which they were trained; thirty-nine percent had worked in the occupation, yet left for various reasons. The researcher concluded that the program needed improvement. Suggestions included: implementing the skills center approach; closer coordination between employment service counselors and vocational instructors; and concentrated job placement effort prior to training completion."
026190472,(OCoLC)12677277,http://purl.flvc.org/fcla/dt/13503,"Some farmers believe the century-old open and competitive farm marketing system is obsolete . They would substitute price-fixing through a farm bargaining association designed to yield cost of production plus a ""fair"" profit to the farmer. The research done by marketing specialists and economists in most of our leading land-grant colleges indicates farm bargaining is not the panacea to greater cash returns to the farmer ... for all farm commodities. Testimony given before the House and Senate of the Ninety-Second Session of the Congress of the United States last September, October and November failed to generate the votes necessary for passage of H. R. 7597, a farm bargaining bill. Price-fixing through compulsory farm bargaining can mean higher consumer prices, substitute foods including synthetics, loss of freedom to choose with whom to do business, damaged export markets where price is critical, discrimination against non-association producers, and more federal control."
026189817,(OCoLC)12636696,http://purl.flvc.org/fcla/dt/13588,"This was prepared as the thesis required for the Master of Business Administration degree. A direct mail questionnaire was used with selected groups of local credit grantors to ascertain their credit granting procedures and their delinquency and loss experience. Delinquency and loss factors were utilized as the distinguishing criteria of credit problem areas. Significant problems were found to exist in the areas of over extension, non-availability of credit, and the delinquency and loss factors of retail credit grantors."
026014441,(OCoLC)428975577,http://purl.flvc.org/fau/fd/FA00000303,"Corporate restructuring may be defined as the reorganization of a company with the aim of improving efficiency. This dissertation examines two corporate restructuring activities, namely (i) spinoffs and (ii) mergers and acquisitions. The first essay examines whether poison pill adoptions by impending spinoff subsidiaries is consistent with goal of shareholder wealth maximization. The main implication of my findings is that poison pills do not deter takeovers; not even in environments where takeovers are more likely. Hence, poison pill adoptions may not be motivated by entrenchment. However, since managers' motives are never clear, investors react adversely to poison pill adoptions because of concerns about potential abuse of power by management. Interestingly, the evidence suggests that poison pills have a positive effect on firm value over the longterm. One possible explanation for this finding is that the potential for abuse associated with poison pills promote shareholder activism. Since activist shareholders closely monitor managers, poison pills indirectly enhance firm value. The second essay examines whether spinoff withdrawals are in response to (i) the market reaction to the initial spinoff announcement, (ii) changes in the estimated value of the unit over the spinoff interval, and (iii) changes in expected spinoff gains owing to changes in market conditions within the subsidiary's industry. It takes 7 months to complete an announced spinoff, on average, over which time industry conditions are likely to change. The main implications of my findings are that managers learn from the market and track changes in industry conditions when making spinoff decisions. It appears that managers time spinoffs for periods when the subsidiary's industry valuations are high to fetch a better price in the market for the unit. These practices are consistent with the goal of maximizing shareholders' wealth. The third essay examines whether having outside blockholders with a higher propensity to monitor managers cause variations in (i) abnormal announcement returns, (ii) proportional wealth gains, (iii) takeover premiums, and (iv) payment methods. The evidence supports the view that the types of outside blockholders that targets and bidders have, in relation to their propensity to monitor managers, affect bargaining position. Firms that have outside blockholders with higher propensities to monitor managers experience higher takeover gains because monitoring limits takeover related agency costs. Therefore, acquisitions create agency problems for minority shareholders of the target and bidder firms, when managers are not monitored."
026190082,(OCoLC)12659702,http://purl.flvc.org/fcla/dt/13538,"The Managerial Grid is examined as an organization development approach for a large manufacturing corporation. Using the case study method, the results of a seven year history of Grid activities are measured in terms of performance, culture, and several other categories. Conclusions are reached that Phase 2 of the Grid has a statistically significant impact on the organization when measured against Phase ?? (no Grid activity) and the results of Phase 1 (the Grid Seminar). The paper also discusses the significance of change and five other approaches to behavioral science-based organization development."
021382937,(OCoLC)256841418,http://purl.flvc.org/fau/fd/FA00000304,"The purpose of this study is to explore environmental and personal factors that may influence college undergraduates' decisions to pursue a major in information technology. These factors include self-efficacy, outcome expectations, personality traits, interest in computers, attitudes, subjective norm, perceived behavioral control, and perceived IT job availability. The paper develops and tests a theoretical model based on social cognitive theory and the theory of planned behavior, and also incorporates the five factor model of personality. The intent of this study is to extend the social cognitive theory and theory of planned behavior literatures by expanding their application to IT career choice issues and by including personality traits as additional factors. The latter addition also indicates a unique application of the five factor personality model, as it is rarely used in concert with self-efficacy, outcome expectations, and broad environmental factors such as job market demands. A multi-section survey was administered to college undergraduates at four large universities in the southeastern United States. Analysis of the data results showed that college undergraduates with positive attitudes towards the IT major and high perceived behavioral control regarding the IT major had a greater intention of pursuing IT. The study also found positive links between 1) computer self-efficacy and self-evaluating outcome expectations regarding an IT career, 2) computer self-efficacy and perceived behavioral control, and 3) self-evaluating outcome expectations and attitudes towards the IT major. In addition, personality traits moderated a number of model relationships. Finally, it was found that males were significantly more likely to choose IT than females and scored higher on computer self-efficacy, self-evaluating outcome expectations, attitudes towards the IT major, interest in computers, and perceived behavioral control. The results and contributions of the study are discussed and recommendations are made for future research."
026190109,(OCoLC)12659732,http://purl.flvc.org/fcla/dt/13504,"This thesis was prepared as a study of the real estate agent's own professional image compared to his actual behavior in the state of Oregon. Methods employed in substantiating this concept and its corollaries include: questionnaire, interviews, and scholarly research. The thesis is divided into two objectives, testing three hypotheses. The categories for measurement include breakdown in the agent's knowledge of technical aspects of conducting real estate transactions and a breakdown in performance due to a lack of follow-up on details to conclude a real estate transaction. After extensive analysis employing the projective technique, it was found that remedial programs should be instituted in both areas."
026460414,(OCoLC)42670378,http://purl.flvc.org/fcla/dt/15627,"For a stock market to allocate funds efficiently, stock prices should immediately incorporate all of the information available. If we find that there is a lag between changes in variables that might affect the price of stocks, and the reflection of that change in its price, the market for stocks will be inefficient. This thesis tests the stock markets in six of the largest developed economies for informational efficiency. It tests the stock markets in Canada, France, Germany, Japan, The United Kingdom, and The United States, for the existence of a causal relationship between changes in the money supply and changes in stock prices, and applies the Granger-causality test to perform it. A stock market is informationally inefficient if a causal relationship between changes in the money supply and changes in stock prices is found. In this case, money supply changes could be used to predict movements in the prices of stocks, create profitable trading rules, and help us earn above-normal returns, thus casting doubts on the ability of the stock market to allocate funds efficiently."
026189762,(OCoLC)12636611,http://purl.flvc.org/fcla/dt/13505,"Raising membership dues or leveling assessments causes membership problems for association executives. What income producing service programs are available to build total revenue and enable an association to develop or expand? Interviews were held with key association executives to obtain their views. A fifteen question (one hundred part) questionnaire was developed from the results of the interviews and secondary research. It was mailed to a select list of different types of organizations, sixty percent of whose chief executive is a Certified Association Executive (CAE). Fourteen questions requested information about income sources in use or planned for use and the respondents personal opinion of associations today and their projected future. A list of income ideas was compiled from the replies. Question fifteen pertained to information on the respondent. The tabulated responses of the question reflect the importance of thorough executive selection. Association successes and failures are keyed to the chief executive's own innate abilities, experiences and influences."
020852026,(OCoLC)227787994,http://purl.flvc.org/fau/fd/FA00000305,"Under Rule 10b-5 of the Securities Exchange Act of 1934, investors are provided a cause of action for losses resulting from management's intentionally deceptive disclosure or non-disclosure of information. Since lawsuits are costly, managers should be motivated to avoid a securities fraud class action. Prior research argues that managers attempt to mitigate the adverse effects of class actions by preempting negative eamings surprises (Skinner 1994 ). However, this study argues that when a firm is overvalued, managers have incentives to avoid value reducing disclosure, which may lead to the violation of securities fraud laws. I investigate this assertion by testing associations between overvalued equity and the two outcomes of a securities fraud class action: dismissals and settlements. Other relevant factors related to overvalued equity are also tested and measured. These other factors include cases where the lead plaintiff is an institution, the length of the class period, the intrinsic value of exercisable CEO in-the-money stock option holdings, and corporate governance as measured by a corporate governance score and the occurrence of a GAAP violation. Findings show that the likelihood of a non-dismissal increases when an institution is the lead plaintiff and CEOs of overvalued firms hold higher amounts of in-the-money options. In addition, results suggest that for overvalued firms, stronger governance increases the probability of a non-dismissal."
029297621,(OCoLC)25036917,http://purl.flvc.org/fcla/dt/13838,"The study investigates and describes the operational characteristics of businesses engaged in the practice of Landscape Architecture. The data from which the study was made was gathered by survey, the sample for which was all those firms carried in the rolls of the American Society of Landscape Architects . The study describes the income and expense characteristics of Landscape Architectural firms, the observation being made that the patterns of income and expense vary for different size firms. These variances in income and expense patterns will be of interest to anyone involved in the administration or ownership of a Landscape Architectural practice."
026206291,(OCoLC)13108945,http://purl.flvc.org/fcla/dt/14227,"This thesis describes the use and implementation of the PEIRCE DBMS. PEIRCE is an easy-to-use, efficient, portable and relationally complete database management system. The design philosophy behind PEIRCE is to provide a powerful and efficient data manipulation language that can be easily implemented on a variety of computers, including microcomputers. PEIRCE requires the user to learn only a small number of simple, yet powerful commands. It is PEIRCE not the user that bears the burden of efficiently implementing these commands. PEIRCE has been entirely written in C to enhance portability to many computers."
029038512,(OCoLC)51851988,http://purl.flvc.org/fau/fd/FADT12009,"Financial regulations require publicly traded firms to disclose firm-specific information relating to their financial performance as well as forecasts of future prospects disclosed to anyone outside the firm. Profit warnings present important market information as to the recent past firm performance as well as a glimpse into the firm's future prospects. By implementing Regulation Fair Disclosure (FD) in October 2000, the Securities and Exchange Commission (SEC) attempted to change the information environment by reducing information asymmetry between analysts and the investing public. This dissertation examines the impact of Regulation (FD) as it relates to three specific areas. Essay One examines Regulation FD's impact on market reaction to profit warnings by U.S. firms and finds significant market reaction over a two-day announcement window. The analysis in this dissertation documents statistically significant changes in the extent of the market reaction in the pre- and post-Regulation FD periods. Evidence is also presented that indicates a significant reduction in information leakage (as measured by negative cumulative abnormal returns (CARs) in stock price for firms in the two-week period immediately prior to a profit warning. Essay Two focuses on American Depositary Receipts (ADRs) and examines differences in comparative market reaction (ADRs versus U.S. stocks) in the pre and post-Regulation FD periods. Essay Three tests the market reaction to profit warnings for commercial bank stocks in the pre- and post-Regulation FD periods with particular attention focused on the contagion effect. The empirical analysis in this dissertation seeks to answer the question of whether the implementation of Regulation FD successfully achieves the SEC's goal of reducing information asymmetry between analysts and investors."
023731763,(OCoLC)36687524,http://purl.flvc.org/fcla/dt/12486,"Three models have been proposed to measure service quality in the marketing literature. These models are: (1) Perception minus Expectations (P-E) Model, (2) Ideal Point (IP) Model, and (3) Performance-based (P-based) model. Underlying the models are two types of attributes: (a) vector point attributes (in the P-E and P-based models), and (b) ideal point attributes (in the IP model). With vector point attributes, increasing performance levels produce increased levels of favorable evaluation by customers. With ideal point attributes, increased levels of performance produces favorable evaluation up to the ideal, but beyond the ideal further performance is unfavorably evaluated. This research extends the attribute typology by introducing a third type called the ""threshold point attribute."" Threshold point attributes are those where customers' evaluation are posited to be favorable when performance increases up to a threshold point. Beyond the threshold point increases in performance are not accompanied by incremental increases in favorable evaluation (as with vector attributes), nor do they turn negative (as with ideal point attributes). That is, the marginal change in evaluation (whether an increase or decrease) is zero after the threshold level. In addition to extending the attribute typology, this research also proposes an enhanced model which subsumes vector, ideal and threshold point attributes. Because of its inclusiveness, the enhanced model is hypothesized to better represent the construct of service quality than the P-E, IP, and P-based models. A survey was mailed to 4,975 customers of an internationally known service firm. Results of a piecewise regression analysis on the data show that threshold point attributes exist in services. The enhanced model, however, does not perform better than other models in criterion and construct validity tests. One significant implication for managers is that they can avoid expenditures on features that customers do not desire beyond a threshold level. The most important direction for future research is to develop and test a contingency theory of customers' attribute classifications."
027568244,(OCoLC)46815081,http://purl.flvc.org/fcla/dt/12644,"This dissertation examines the effect of variables specific to different industries on initial public offerings (IPOs). It has been widely accepted that IPOs perform well in the immediate aftermarket and perform poorly in the subsequent months. The uncertainty surrounding IPOs has been a frequently cited reason for the initial underpricing. The size of the offering, underwriter prestige, the number of uses of gross proceeds, and the level of inside ownership are a few of the variables that have been found to measure the uncertainty of IPOs across industries. The uncertainty of IPOs in different industries may also be affected by variables that are unique to that industry. The level of interest rates and the amount of regulation may affect the performance of existing financial service firms. The uncertainty of IPOs in the financial services industry may also be affected by these variables. This study finds that some financial service firm IPOs are affected by the level of interest rates. Some regulatory changes increase the uncertainty, and therefore the initial returns, of IPOs of financial service firms. The type of ownership structure affects the management of a firm due to differing agency costs. A mutual holding company (MHC) is a mutual company that issues a minority stake to the public. The MHC structure has been common among savings banks and is growing in popularity in the life insurance industry. The lack of takeover possibilities and stockholder control diminishes the risk taking behavior of MHCs in the thrift industry. Savings banks that choose the MHC structure experience lower initial returns without significant long run differences than savings banks that choose to convert to a completely stockholder owned bank. The operating characteristics may also affect the uncertainty of the firm. The internet allows firms to enter into an industry while having completely different operating structure than many of the other competitors. This study finds that firms that have an internet focus have higher initial returns than a matching set of IPOs. The changing environment, due to technology and low barriers to entry, increases the uncertainty of internet firms."
025330853,(OCoLC)41424240,http://purl.flvc.org/fcla/dt/12521,"Contemporary finance theory suggests that the appropriate goal of the management of a corporation should be to maximize the contribution of the shareholder's ownership in the corporation to the shareholder's wealth. A related objective of the firm's management that is consistent with this prime objective should be to minimize the cost of all inputs into the firm's income producing process. This would include minimizing the cost of the capital required to fund the firm's operations. This study examines the cost of debt to firms issuing new debt. Using a sample of new debt issues between 1988 and 1993 drawn from a listing compiled by the Capital Markets Division of the Federal Reserve Board of Governors, this study finds that when underwriters are categorized by recent (last year) experience, the issuing firm's choice of an underwriter does not affect the offering yield required of the issuer in excess of several benchmark yields. Excess yield is tested with respect to 3-month treasury bills, 10-year constant maturity treasury securities, the average contemporary yield on AAA rated corporate bonds, and the average contemporary yield on new corporate issues carrying the same rating. The results do suggest that the issuing firm's choice of underwriter does affect the underwriter spread that the issuer will be charged. The implication of the results to corporate issuers of new debt is that choosing an experienced underwriter (defined in the study as having appeared in the listing of the top ten underwriters of corporate debt reported by Wall Street Journal in the previous year) could lead to reduced overall net interest costs stemming from the reduced underwriter spread."
